Title,Summary,Date
"Bitcoin, Ethereum Take A Breather While Dogecoin Spike Pushes Crypto Market Cap Above $2.6 Trillion; Team Biden Unveils Comprehensive Policy For Federal AI Use: Here's What It Entails - Top Headlines Today While US Slept",Looking for stock market analysis and research with proves results? Zacks.com offers in-depth financial research with over 30years of proven results.,2024-03-28
"US Economic Growth Upwardly Revised To 3.4% In Q4, Jobless Claims Slow: Thursday's Economic Digest",Looking for stock market analysis and research with proves results? Zacks.com offers in-depth financial research with over 30years of proven results.,2024-03-28
"Waller Pushes On Open Door: Push For Patience Lifts The Dollar, Complicating Japanese Efforts","Comments by Fed Governor Waller, urging patience on rates and wanting more evidence that price pressures are moderating, has helped the greenback extend its recent gains.",2024-03-28
Why The Market May Be About To Get Turned Upside Down,The underlying fundamentals and several macro trends imply that the market's current trend could be about to get turned upside down. Click here for a detailed analysis.,2024-03-28
"Stock Market 'Bizarrely' Overvalued, Warns Expert: 'Every Single Indicator...Tell Us We're In A Historic, Historic Bubble'",Looking for stock market analysis and research with proves results? Zacks.com offers in-depth financial research with over 30years of proven results.,2024-03-28
Wall Street Eyes Muted Open As Caution Prevails Before Key Inflation Data: Analyst Sees Buying Opportunities In Any Pullback,Looking for stock market analysis and research with proves results? Zacks.com offers in-depth financial research with over 30years of proven results.,2024-03-28
The S&P 500 has notched 21 record highs in Q1 and is up 10% YTD,Looking for stock market analysis and research with proves results? Zacks.com offers in-depth financial research with over 30years of proven results.,2024-03-28
"Japan Index Falls While Asia And Europe Markets Rise, And Gold Exceeds $2,220 - Global Markets Today While US Slept",Looking for stock market analysis and research with proves results? Zacks.com offers in-depth financial research with over 30years of proven results.,2024-03-28
"Q1 2024 Asset Class Performance, Big Winners And Losers",Looking for stock market analysis and research with proves results? Zacks.com offers in-depth financial research with over 30years of proven results.,2024-03-28
SP 500 Forecast: Continues To Show Volatility,Looking for stock market analysis and research with proves results? Zacks.com offers in-depth financial research with over 30years of proven results.,2024-03-28
Update On Gold Ratios,Looking for stock market analysis and research with proves results? Zacks.com offers in-depth financial research with over 30years of proven results.,2024-03-28
"Stock Market Bubble Expert Warns ""Things Could Get Bloody Fast""",Looking for stock market analysis and research with proves results? Zacks.com offers in-depth financial research with over 30years of proven results.,2024-03-28
"S&P 500 delivers best Q1 in five years, driven by rate cut bets and megacap gains",Looking for stock market analysis and research with proves results? Zacks.com offers in-depth financial research with over 30years of proven results.,2024-03-28
Five Straight,Looking for stock market analysis and research with proves results? Zacks.com offers in-depth financial research with over 30years of proven results.,2024-03-28
"No Matter What The Fed Does, The Lack Of Bears Is Worrisome","Investors' focus on the Federal Reserve and interest rates obscures the high bullishness in the market, raising caution about potential future declines.",2024-03-28
Money Supply Dips For First Time Since November,,2024-03-28
"Catalyst Watch: Tesla deliveries, Disney board vote, DJT drama and Fortinet event",Looking for stock market analysis and research with proves results? Zacks.com offers in-depth financial research with over 30years of proven results.,2024-03-28
"AskSlim Market Week - Friday, March 28",Looking for stock market analysis and research with proves results? Zacks.com offers in-depth financial research with over 30years of proven results.,2024-03-28
Vanguard Commentary: Building Resilient Portfolios Through Diversification,Looking for stock market analysis and research with proves results? Zacks.com offers in-depth financial research with over 30years of proven results.,2024-03-28
The Fed May Push The S&P 500 Into Correction,"Delays in rate cuts by the Fed may trigger a correction in the S&P 500, while short-term investors thrive but bear risks. Read more here.",2024-03-27
"SPDR's GLD Had $363M in Outflows: ETF Fund Flows as of March 27, 2024","Here are the daily ETF fund flows for March 27, 2024.",2024-03-27
Upside/Downside Tug Of War,"Amrita Roy, The Pragmatic Optimist, joins Rob Isbitts to discuss why she's currently neutral on S&P. Macro investing and equity selection: Zscaler, GitLab, and Pinterest.",2024-03-27
"Filling NCAA in ""Sweet 16"" ETF Brackets",The excitement surrounding the National Collegiate Athletic Association (NCAA) Division I Men's Basketball Tournament and its impact on the stock world has led investors to look at ETFs that could act as a proxy for the game.,2024-03-27
A Resurgent Dollar May Be A Headwind For The Stock Market,Central banks globally shifting from rate hikes to rate cuts likely to strengthen the dollar in the coming weeks. Click here to read more.,2024-03-27
A Momentous Week For Monetary Policy Bodes Well For Markets,Looking for stock market analysis and research with proves results? Zacks.com offers in-depth financial research with over 30years of proven results.,2024-03-27
Q1 2024 CIO Overview And Outlook,,2024-03-27
"Investors On Edge With Consumer Inflation Data Due Friday, Rate Cut Hopes Hang In The Balance",Looking for stock market analysis and research with proves results? Zacks.com offers in-depth financial research with over 30years of proven results.,2024-03-27
The S&P 500 is up 5 months straight — and history favors momentum,"The S&P 500 has had a remarkable run over the past five months, chalking up a 25% gain. But contrary to feelings that things have risen too quickly, history says that strength begets strength.",2024-03-27
S&P 500 Forecast: Seeing Sideways Action,Looking for stock market analysis and research with proves results? Zacks.com offers in-depth financial research with over 30years of proven results.,2024-03-27
Manufacturing Rebound Puts Markets Between 'Goldilocks' And 'Reflation Flirtation': Goldman Sachs,Looking for stock market analysis and research with proves results? Zacks.com offers in-depth financial research with over 30years of proven results.,2024-03-27
We think the U.S. avoids a recession in 2024 - Russell Investments,Looking for stock market analysis and research with proves results? Zacks.com offers in-depth financial research with over 30years of proven results.,2024-03-27
Q4 2023 Earnings: Quality Growth Takes Center Stage,Looking for stock market analysis and research with proves results? Zacks.com offers in-depth financial research with over 30years of proven results.,2024-03-27
This Breakout Pullback Could Make Our Entire Month,Looking for stock market analysis and research with proves results? Zacks.com offers in-depth financial research with over 30years of proven results.,2024-03-27
"Bitcoin, Ethereum, Dogecoin Register Little Change Amid Bullish Momentum: Analyst Says $160K Could Be A 'Conservative' Price Target For King Crypto; Biden, Obama Reportedly Join Forces For Election Strategy Amid Fears Of Potential Defeat - Top Headlines Today While US Was Sleeping",Looking for stock market analysis and research with proves results? Zacks.com offers in-depth financial research with over 30years of proven results.,2024-03-27
Russell 2000 Vs. S&P 500: Turning Tide For Small Caps? 'Risk-Reward Trade-Off Is Very Skewed',Looking for stock market analysis and research with proves results? Zacks.com offers in-depth financial research with over 30years of proven results.,2024-03-27
Heightened Threat Of Japanese Intervention Pushes Greenback Away From JPY152,"The dollar set a new 34-year high, spurring a senior official meeting in Tokyo, which in turn took the dollar to JPY151.10. Click here to read more.",2024-03-27
What Are Markets Pricing In?,The major stock market indices in the S&P 500 and Nasdaq are pricing in a significant rebound in growth throughout 2024.,2024-03-27
"Asia And Europe Markets Mixed, Crude Oil Stays Above $80 With Gold Above $2,200 - Global Markets Today While US Slept",Looking for stock market analysis and research with proves results? Zacks.com offers in-depth financial research with over 30years of proven results.,2024-03-27
"US Stocks Set For Rebound, Aim To Snap 3-Session Slump And Close Quarter Strong: Analyst Foresees Robust April Ahead",Looking for stock market analysis and research with proves results? Zacks.com offers in-depth financial research with over 30years of proven results.,2024-03-27
A Rosy Turn In The Market,Looking for stock market analysis and research with proves results? Zacks.com offers in-depth financial research with over 30years of proven results.,2024-03-27
"SPY ETF Update, 3/27/2024",Looking for stock market analysis and research with proves results? Zacks.com offers in-depth financial research with over 30years of proven results.,2024-03-27
NVDA Double Top Formation Impacts Everything,Looking for stock market analysis and research with proves results? Zacks.com offers in-depth financial research with over 30years of proven results.,2024-03-27
"Market Briefing for Wednesday, March 27, 2024",Looking for stock market analysis and research with proves results? Zacks.com offers in-depth financial research with over 30years of proven results.,2024-03-27
"Biden Is Quietly Ditching 'Bidenomics' In Speeches, As Republicans Use The Term Against Him: What's Ahead For 2024 Election?",Looking for stock market analysis and research with proves results? Zacks.com offers in-depth financial research with over 30years of proven results.,2024-03-27
Larry Fink's 2024 Annual Chairman's Letter To Investors,The growth and prosperity generating power of the capital markets will remain a dominant economic trend. Click here to read why.,2024-03-26
"Lululemon: Soft Guidance Pressures Shares, Technical Damage Done","Lululemon's earnings report included a tepid outlook, causing one of the stock's worst post-earnings performances. Read why I reiterate a Hold rating on LULU.",2024-03-26
M2 Update - Still Looking Good,"Today, the Fed released the February money supply data, and there were no unwelcome surprises.",2024-03-26
"Reddit ignites meme stock resurgence, further signs of 'bull market in everything'",Reddit's stock surge is the latest sign that investors' risk appetite hasn't peaked.,2024-03-26
2024 Global Market Outlook - Q2 Update: Pent-Up Exuberance,"Amid an uncertain economic outlook, we're emphasizing the importance of security selection and diversification as the second quarter unfolds.",2024-03-26
SPXU: A Risky Bet On Perfect Timing And Rare Luck,"ProShares UltraPro Short S&P500 is a triple-leveraged, inverse ETF that may only provide downside protection during market chaos. Learn more on SPXU ETF here.",2024-03-26
3 Predictions For The Second Quarter,Equities have enjoyed a solid first quarter as enthusiasm about demand from the AI revolution has been a key factor for gains. Explore more details here.,2024-03-26
CEO Sentiment Is Slowly Improving In 2024,Looking for stock market analysis and research with proves results? Zacks.com offers in-depth financial research with over 30years of proven results.,2024-03-26
Perception Vs Reality: How Healthy Is The Stock Market Really?,Looking for stock market analysis and research with proves results? Zacks.com offers in-depth financial research with over 30years of proven results.,2024-03-26
Advanced Durable Goods Shipments Feb 2024: Still Weak,"Census Bureau released data on Advanced Durable Goods Manufacturers' Shipments, Inventories, and Orders in U.S. for Feb 2024. Click here to read my analysis.",2024-03-26
"Jana Partners Dissolves New Relic Inc Holding, Enters Holding in Trimble",Looking for stock market analysis and research with proves results? Zacks.com offers in-depth financial research with over 30years of proven results.,2024-03-26
Weakness In U.S. Investment Keeps The Focus On The Consumer,Durable goods orders are a good lead indicator for broader capex spending in the US.,2024-03-26
"Jana Partners Cuts Ties with New Relic Inc, Impacting Portfolio by -19.64%",Looking for stock market analysis and research with proves results? Zacks.com offers in-depth financial research with over 30years of proven results.,2024-03-26
"EXCLUSIVE: Interest Rates Rode The Elevator Up, But Analyst Predicts They'll Take 'The Stairs Coming Down'",Looking for stock market analysis and research with proves results? Zacks.com offers in-depth financial research with over 30years of proven results.,2024-03-26
This Slingshot Reversal Could Be Our Biggest Win Of The Week,Looking for stock market analysis and research with proves results? Zacks.com offers in-depth financial research with over 30years of proven results.,2024-03-26
Here are the top and bottom S&P 500 stocks in terms of Q1 stock performance,Looking for stock market analysis and research with proves results? Zacks.com offers in-depth financial research with over 30years of proven results.,2024-03-26
"Financial Markets Report For Tuesday, March 26",Looking for stock market analysis and research with proves results? Zacks.com offers in-depth financial research with over 30years of proven results.,2024-03-26
Where This Market Is Going (Technical Analysis),"The market is currently experiencing short-term Buy Signals, but longer term signals look overbought and toppy. Explore more details here.",2024-03-26
"BlackRock stays risk-on for the short-term, citing falling inflation and likely rate cuts",Looking for stock market analysis and research with proves results? Zacks.com offers in-depth financial research with over 30years of proven results.,2024-03-26
Negative Equity Risk Premium Estimates Persist For U.S. Equities,The roaring US stock market has delivered red-hot gains in recent history but at the expense of future returns.,2024-03-26
Technical Measures And Valuations - Does Any Of It Matter?,"Technical measures and valuations all suggest the market is expensive, overbought, and exuberant. However, none of it seems to matter as investors pile into equities. Click to read.",2024-03-26
Winnebago Industries: Getting Ready For Higher Returns,"Winnebago Industries has performed very well over the years in the very cyclical RV industry, despite facing important risks as mentioned above. Read more here.",2024-03-26
QQQ: Prepare For Turbulence,The tech-heavy Invesco QQQ Trust ETF is sitting near all-time highs. Read more to see why I'm bearish on QQQ fund.,2024-03-26
