Title,Summary,Date
"The $64,000 Question: Can The Stellar Stock Market Run Continue?","Strong start for S&P 500 with a 10% gain in Q1, but caution is advised as technical momentum decreases. Read more on the economy here.",2024-04-03
IVV's $3.4B Tops Inflows; SPY Leads Outflows with $4.1B,"Here are the daily ETF fund flows for April 2, 2024.",2024-04-02
Subtle Signs Of A Cooling Jobs U.S. Market Will Aid The Fed's Inflation Fight,"The number of job vacancies remains elevated, but is moving into better balance with the supply of available workers. Read what investors need to know.",2024-04-02
Staying Nimble While Seeking Income,"Yields have surged across fixed income in the new regime. In Q2, we stay nimble and selective, preferring short-term sovereign bonds and high yield credit. Click to read.",2024-04-02
"Manufacturers' Shipments February 2024: Weak, But Not Weak Enough",US manufacturing shrinks further as inflationary pressures arise. Click to see my look at the manufacturing sector and what that may mean for markets going forward.,2024-04-02
Prepare For S&P 6000 (And Higher) In The Coming Years-Long Bull Market,Looking for stock market analysis and research with proves results? Zacks.com offers in-depth financial research with over 30years of proven results.,2024-04-02
Q1 2024 Buyback and Dividend Increases Point to Improving Corporate Sentiment,Looking for stock market analysis and research with proves results? Zacks.com offers in-depth financial research with over 30years of proven results.,2024-04-02
Market Corrections Matter More Than You Think,"Over the next few months, the markets can extend the current deviations from the long-term mean even further.",2024-04-02
Could 3 Powerful Fund Managers Take Control Of US Banks?,Looking for stock market analysis and research with proves results? Zacks.com offers in-depth financial research with over 30years of proven results.,2024-04-02
"Total Return Forecasts: Major Asset Classes - April 2, 2024",US equities are on track to generate materially softer results relative to realized performance over the past decade. Read what investors need to know.,2024-04-02
"XIU: Canada's Market Lags The United States For Good Reason, But It Won't Last Forever",The iShares S&P/TSX 60 Index ETF has drastically underperformed the SPDR S&P 500 ETF Trust over the last 10 years. Explore more details here.,2024-04-02
"S&P 500's Q1 Standouts: Energy, Communication Sectors In The Lead — 10 Top-Performing Stocks",Looking for stock market analysis and research with proves results? Zacks.com offers in-depth financial research with over 30years of proven results.,2024-04-02
"SPY, AMZN, LLY, COST: Large Outflows Detected at ETF",Looking for stock market analysis and research with proves results? Zacks.com offers in-depth financial research with over 30years of proven results.,2024-04-02
ETF Flows Report for 04/02/2024,Looking for stock market analysis and research with proves results? Zacks.com offers in-depth financial research with over 30years of proven results.,2024-04-02
"Another State Takes On BlackRock, Claiming 'Fraudulent Action' With Its ESG Policies As ESG Backlash Intensifies Against Biden's Wishes",Looking for stock market analysis and research with proves results? Zacks.com offers in-depth financial research with over 30years of proven results.,2024-04-02
March ETF inflows nearly doubled February’s capital inflows- Citi,Looking for stock market analysis and research with proves results? Zacks.com offers in-depth financial research with over 30years of proven results.,2024-04-02
"Bitcoin, Ethereum, Dogecoin Dip In Market Correction: Analyst Expects All-Time Highs For King Crypto As Halving Nears; US And UK Team Up To Regulate And Address Risks Of Emerging Artificial Intelligence - Top Headlines Today While US Was Sleeping",Looking for stock market analysis and research with proves results? Zacks.com offers in-depth financial research with over 30years of proven results.,2024-04-02
Historic S&P 500 Rally In Q1 Flashes Bullish Signals For 2024: 'Only The Ninth Time Since 1940',Looking for stock market analysis and research with proves results? Zacks.com offers in-depth financial research with over 30years of proven results.,2024-04-02
Tuesday Talk: April Is The Cruelest Month?,Looking for stock market analysis and research with proves results? Zacks.com offers in-depth financial research with over 30years of proven results.,2024-04-02
"Gold, Oil, And Interest Rates Rise","The Dollar Index made a new high for the year, a little above 105, which had been anticipated by the new lows recorded by the Bannockburn World Currency Index last week.",2024-04-02
Outperforming ETF manager names a potential ‘50-bagger’ in the stock market,Looking for stock market analysis and research with proves results? Zacks.com offers in-depth financial research with over 30years of proven results.,2024-04-02
Q1 2024 Macroeconomic Review: Tenacious Inflation's Lingering Impacts,Q1 2024 demonstrated that taming inflation would be a more arduous task than many had hoped.,2024-04-02
"Wall Street Set For Weak Open As Fed Speeches, Key Data Eyed: Amid Bitcoin Plunge And Gold Spike, Market Analyst Sees 'Nothing Breaking The Upward Trend'",Looking for stock market analysis and research with proves results? Zacks.com offers in-depth financial research with over 30years of proven results.,2024-04-02
"SPY ETF Update, 4/2/2024",Looking for stock market analysis and research with proves results? Zacks.com offers in-depth financial research with over 30years of proven results.,2024-04-02
Equity Investing: A Strategic Mindset For A Changing World,"With inflation and interest rates in transition, it's time to take a fresh look at the forces driving business models, profitability and equity returns.",2024-04-02
"Asia And Europe Markets Mixed, Crude Oil Tops $85 And Gold Hits A New Peak At $2,280 - Global Markets Today While US Slept",Looking for stock market analysis and research with proves results? Zacks.com offers in-depth financial research with over 30years of proven results.,2024-04-02
"Dow Knocking On The Door Of 40,000","If economic data slows significantly or the country goes into a recession, then the probability of sooner and/or more Fed interest rate cuts will increase.",2024-04-02
Stocks Are Partying Like It Is 1995,"While inflation came down slowly over time back then, it sure looks like the federal government is also inflating away some of its COVID-era debts right now.",2024-04-02
A Deep Dive Into Investing Strategies For A Rich Retirement,Check here to learn more about the key strategies for successful retirement planning in the face of high inflation and rising home prices.,2024-04-02
The Stock Market's Decline May Have Only Begun,Looking for stock market analysis and research with proves results? Zacks.com offers in-depth financial research with over 30years of proven results.,2024-04-02
Major averages are on pace to close out worst day of trading in nearly a month,Looking for stock market analysis and research with proves results? Zacks.com offers in-depth financial research with over 30years of proven results.,2024-04-02
4 Factor Dividend Growth Portfolio - A Strong Finish To Quarter 1,"The 4-factor dividend growth portfolio strategy outperformed the S&P 500 and SCHD, generating significant alpha over time. Read more here.",2024-04-02
Hit Them Where They Ain't,Looking for stock market analysis and research with proves results? Zacks.com offers in-depth financial research with over 30years of proven results.,2024-04-02
Streaks Of The S&P 500,Looking for stock market analysis and research with proves results? Zacks.com offers in-depth financial research with over 30years of proven results.,2024-04-02
Investor Memo Q1 2024: The Market Throws Caution To The Wind,Looking for stock market analysis and research with proves results? Zacks.com offers in-depth financial research with over 30years of proven results.,2024-04-02
Russell 2000 Index Best And Worst Performing Stocks Of 2024,Looking for stock market analysis and research with proves results? Zacks.com offers in-depth financial research with over 30years of proven results.,2024-04-02
Short-Term Vs. Long-Term Bonds: Analysis And Comparison,"Read here for an analysis of short-term vs. long-term bonds, exploring their characteristics and comparing dividends, returns, capital gains, risk, and volatility.",2024-04-01
"The Stock Market Is Not In A Bubble, No Foolin'","The idea of bubbles in the economy and markets is mostly wrong or early, with things currently seeming pretty good. Explore more details here.",2024-04-01
"Stocks Fall As Dollar, Treasury Yields Jump On Upbeat Manufacturing Data, VIX Rallies: What's Driving Markets Monday?",Looking for stock market analysis and research with proves results? Zacks.com offers in-depth financial research with over 30years of proven results.,2024-04-01
Small-Cap Stocks: A New Dawn?,Looking for stock market analysis and research with proves results? Zacks.com offers in-depth financial research with over 30years of proven results.,2024-04-01
Major Asset Classes: March 2024 Performance Review,"The rally in global assets broadened in March, lifting nearly every slice of the major asset classes. The downside outlier: bonds in emerging markets. Click to read.",2024-04-01
US Manufacturing Activity Hits Highest Growth In 18 Months: 'Clear Signs Of Improving Conditions',Looking for stock market analysis and research with proves results? Zacks.com offers in-depth financial research with over 30years of proven results.,2024-04-01
"EXCLUSIVE: Top 10 Most Searched Tickers On Benzinga Pro In March: Where Do Tesla, Nvidia, SPY And Reddit IPO Rank?",Looking for stock market analysis and research with proves results? Zacks.com offers in-depth financial research with over 30years of proven results.,2024-04-01
These (2) Range Traps Could Double Our Profits On Tuesday,Looking for stock market analysis and research with proves results? Zacks.com offers in-depth financial research with over 30years of proven results.,2024-04-01
"Financial Markets Report For Monday, April 1",Looking for stock market analysis and research with proves results? Zacks.com offers in-depth financial research with over 30years of proven results.,2024-04-01
The March Labor Report Preview: The Cracks Are Deepening,"Expectations for March labor market data show a potential slowdown in job creation and a weakening labor market, raising concerns about recession. Read more here.",2024-04-01
"Weekly Market Pulse: Don't Just Do Something, Sit There",Gold and commodities both rose while small and mid-cap stocks also had solid quarters. About the only losers were bonds and REITs both down in a rising rate environment. Click to read.,2024-04-01
Investors are sellers of fund assets for the second consecutive week,Looking for stock market analysis and research with proves results? Zacks.com offers in-depth financial research with over 30years of proven results.,2024-04-01
US Stocks Set To Start Fresh Week On Positive Note As Traders Take Inflation Data In Their Stride: Analyst Explains Why Rally Will Likely Extend Through 2024,Looking for stock market analysis and research with proves results? Zacks.com offers in-depth financial research with over 30years of proven results.,2024-04-01
"Asia Markets Mixed, Europe Closed, While Gold Hits Fresh Record High - Global Markets Today While US Was Sleeping",Looking for stock market analysis and research with proves results? Zacks.com offers in-depth financial research with over 30years of proven results.,2024-04-01
S&P 500 Closes Its Best Quarter Since 2019 At Record High,Looking for stock market analysis and research with proves results? Zacks.com offers in-depth financial research with over 30years of proven results.,2024-04-01
"Yields Up, Dollar Up, Junk Bonds Tumble",Looking for stock market analysis and research with proves results? Zacks.com offers in-depth financial research with over 30years of proven results.,2024-04-01
"Essentially Sideways In March, Nasdaq 100 In Search Of Catalyst",Looking for stock market analysis and research with proves results? Zacks.com offers in-depth financial research with over 30years of proven results.,2024-04-01
10 Dividend Growth Stocks: March 2024,I rank a selection of Dividend Radar stocks and present the ten top-ranked stocks for consideration. Check out the candidates for March.,2024-04-01
"Investing Is The Priority, Now I See Trades In Apple, And Others","Investing in small caps and various sectors still offers opportunities. Read why tech stocks like Apple, Snowflake, and Dell present trading opportunities.",2024-03-31
S&P 500: How Can Anyone Buy This High?! - Week Starting 1st April (Technical Analysis),S&P500 closed Q1 high at 5254 with a PE ratio of 24.6. Inflection points minimize risk.,2024-03-31
Lightly-regulated techs may be a tempting target for big-spending government - BofA,Looking for stock market analysis and research with proves results? Zacks.com offers in-depth financial research with over 30years of proven results.,2024-03-31
Bull Market Momentum Is Gaining Strength,"Positive first quarter performance and improving financial conditions inspire a bright outlook for 2024, fueled by a thriving manufacturing industry and...",2024-03-31
My Top 10 High Yield Dividend Stocks For April 2024,Discover top performing ETFs and high dividend yield stocks for robust returns.,2024-03-31
The Stock Market: Doing Well,"S&P 500 hits 22nd all-time high, strong economy with Q4 growth, optimism over AI tech, potential rate cuts, and increased consumer confidence.",2024-03-31
Berkshire Hathaway: Getting Harder For Buffett To Beat The Market,"Berkshire Hathaway stock has recovered with the broad market and kept pace with the S&P 500, but even Buffett thinks generating alpha could get harder moving ahead.",2024-03-31
An Eggs-cellent First Quarter -- What’s In Store For The Rest Of 2024?,Looking for stock market analysis and research with proves results? Zacks.com offers in-depth financial research with over 30years of proven results.,2024-03-31
The Market May Not Like What This Week's Data Means For Rate Cuts,April's first week will bring significant data on the jobs front. The data will have a significant impact on bonds and the dollar. Click here to read more.,2024-03-31
An Eggs-Cellant First Quarter! What’s In Store For The Rest Of 2024?,Looking for stock market analysis and research with proves results? Zacks.com offers in-depth financial research with over 30years of proven results.,2024-03-31
IVV: S&P 500 Dashboard For April 2024,"iShares Core S&P 500 ETF is an ETF tracking S&P 500 index, less popular than SPY but with a lower expense ratio. Read more on IVV ETF here.",2024-03-31
The Newsletter For April 2024,Looking for stock market analysis and research with proves results? Zacks.com offers in-depth financial research with over 30years of proven results.,2024-03-31
This Tech Trend Could Improve Stock Market Transactions,Looking for stock market analysis and research with proves results? Zacks.com offers in-depth financial research with over 30years of proven results.,2024-03-30
Stocks just had their best first quarter in 5 years — here's where strategists think the market is headed,"With stocks off to their best start in five years, many strategists on Wall Street still make a case for the S&P 500 to keep chugging higher.",2024-03-30
Mining The CoT Report: What Hedge Funds Are Buying; The Future Via Futures,Looking for stock market analysis and research with proves results? Zacks.com offers in-depth financial research with over 30years of proven results.,2024-03-30
"Beware Nvidia and the S&P 500 ‘index waltz,’ says this market-beating fund manager",Looking for stock market analysis and research with proves results? Zacks.com offers in-depth financial research with over 30years of proven results.,2024-03-30
April 2024 Monthly,The macroeconomic and geopolitical developments have not changed substantially over the past month. Click here to read more.,2024-03-30
PCE Report: The 'Inflation Bump' Just Got Bigger,"An article highlighting the recent spike in core PCE data, indicating potential inflationary pressures and the impact on stock market and Fed decisions.",2024-03-30
S&P 500's Record Quarter And My Top Mag 7 Stocks,Discover the reasons behind the S&P 500's record-breaking first quarter and explore the top investment picks for Q2 as shared by a financial writer. Read more here.,2024-03-30
Weekly Commentary: On Currency Watch Following Melt-Up Q1 2024,"While 10-year Treasury yields jumped 32 bps during Q1 to 4.20%, corporate Credit notably outperformed.",2024-03-30
Stocks Meet Fewer Cuts,Looking for stock market analysis and research with proves results? Zacks.com offers in-depth financial research with over 30years of proven results.,2024-03-30
My Current View Of The Market: April 2024 Edition (Technical Analysis),"Using a 10-month EMA and relative strength ratios to determine the allocation of retirement funds among 4 ETF choices, with SPY at 100% allocation in April.",2024-03-30
Fed's Wait And See About Rate Cuts Supported By Highest Since July 6-Month Core PCE And Core Services PCE Inflation,"Core PCE price index, the inflation index that the Fed is focused on and refers to all the time, was revised up for January to an annualized month-to-month growth rate of 5.6%",2024-03-30
"U.S. Weekly Fund Flows Insight Report: Core Bond Funds See 21 Straight Weeks Of Inflows, Backing The Short/Intermediate IG Group's Success","Investors were net redeemers of fund assets for the second straight week, removing $7.5 billion. Read more here.",2024-03-30
Inflation Remained Elevated In February,"When inflation picked back up in January 2024, many commentators described it as more noise than signal.",2024-03-29
You Can Do Better Than the Dow Jones. Buy This ETF Instead.,"The blue-chip index is made up of rock-solid companies, but it's missing an important sliver of the overall market.",2024-03-29
"Fed's Preferred Inflation Gauge Rose 2.8%, as Expected",February's monthly inflation rate cooled from January and rose less than analysts had expected.,2024-03-29
Key Inflation Index Keeps to Fed Expectations,Looking for stock market analysis and research with proves results? Zacks.com offers in-depth financial research with over 30years of proven results.,2024-03-29
PCE February 2024: Personal Spending Too Hot For Fed Rate Cuts,"Real PCE (adjusted for inflation) in February 2024 expanded by 0.43%, significantly surpassing economists' expectations of 0.10% growth. Click to read",2024-03-29
The Disinflation Narrative Has Been Shattered,"Concerns arise as goods inflation and energy prices rebound, posing a challenge to reaching the 2% inflation target.",2024-03-29
S&P 500's Bull Run To Continue: ETFs To Bet On,Looking for stock market analysis and research with proves results? Zacks.com offers in-depth financial research with over 30years of proven results.,2024-03-29
"Sticky Inflation Persists: Fed's Preferred Measure Climbs, Analysts Sound Off",Looking for stock market analysis and research with proves results? Zacks.com offers in-depth financial research with over 30years of proven results.,2024-03-29
Rare Buying Opportunity: Big Dividends With Very Attractive Risk-Reward,Check here to learn why now is the perfect time for investors to explore discounted dividend stocks with great potential for high returns and limited risks.,2024-03-29
Core Bond Funds See 21 Straight Weeks of Inflows,Looking for stock market analysis and research with proves results? Zacks.com offers in-depth financial research with over 30years of proven results.,2024-03-29
Resurging Corporate Profits Show Inflationary Pressures Are Reheating After Lull: Corporate Profits By Major Industry,,2024-03-29
"Did Bitcoin, Gold Or S&P 500 Make You Richer This Quarter? What $1000 Invested In These Asset Classes Would've Returned",Looking for stock market analysis and research with proves results? Zacks.com offers in-depth financial research with over 30years of proven results.,2024-03-29
"SPY ETF Update, 3/29/2024",Looking for stock market analysis and research with proves results? Zacks.com offers in-depth financial research with over 30years of proven results.,2024-03-29
Is the stock market open on Good Friday?,Looking for stock market analysis and research with proves results? Zacks.com offers in-depth financial research with over 30years of proven results.,2024-03-29
What’s The Outlook For U.S. Q1 Earnings Season?,Looking for stock market analysis and research with proves results? Zacks.com offers in-depth financial research with over 30years of proven results.,2024-03-29
Bitcoin Vs. Gold Vs. SPY: Which Asset Class Would've Given Best Returns On $1000 Investment In Q1?,Looking for stock market analysis and research with proves results? Zacks.com offers in-depth financial research with over 30years of proven results.,2024-03-29
M2 Money Grew At Annual 8% Compound Rate Since March 2020,"The velocity of circulation of the M2 money stock has risen modestly in recent months, but still remains at very low levels. Read more here.",2024-03-28
IVV: The S&P 500 Is Not Expensive,"iShares Core S&P 500 ETF (IVV) is an ideal investment option with balanced growth potential and a low fee percentage. Read more on IVV ETF here,",2024-03-28
"Stocks Hop Into March At Record Highs, Gold Shines","Energy and Materials sectors performed well, while the Nasdaq 100 ETF underperformed amid a cool-down in the AI momentum trade. Explore more details here.",2024-03-28
"Stocks Hop Into April At Record Highs, Gold Shines","Energy and Materials sectors performed well, while the Nasdaq 100 ETF underperformed amid a cool-down in the AI momentum trade. Explore more details here.",2024-03-28
5 Best Stocks That Powered the S&P 500 ETF in Q1,"The S&P 500 is on track for its best first quarter since 2019, having gained 10%. While many stocks have powered the ETF, we have highlighted five that have gained at least 40% this year.",2024-03-28
All Or Nothing Comes Back,"Recently, all-or-nothing days have been hard to come by. On a rolling 200-day basis, only 4.5% of days have registered such readings. Read what investors need to know.",2024-03-28
PCE February 2024 Preview: Markets Could Make A Big Move,Get insights on the upcoming release of US Personal Consumption Expenditures data by BEA for February 2024 and its impact. Click here for my PCE preview.,2024-03-28
"Schlumberger: Earnings And FCF Growth On Track, Higher Oil A Tailwind",Schlumberger Ltd. share-price momentum has improved since early February amid the rise in global oil prices. Read more on SLB stock here.,2024-03-28
The Market Will Soon Hit An Air Pocket And Drop 20% In A Matter Of Months,Looking for stock market analysis and research with proves results? Zacks.com offers in-depth financial research with over 30years of proven results.,2024-03-28
"Stocks Pause As Traders Reassess Interest Rate Path, Gold Makes New Highs, Bitcoin Rebounds: What's Driving Markets Thursday?",Looking for stock market analysis and research with proves results? Zacks.com offers in-depth financial research with over 30years of proven results.,2024-03-28
William Blair Commentary: Can AI Be Ethical?,Looking for stock market analysis and research with proves results? Zacks.com offers in-depth financial research with over 30years of proven results.,2024-03-28
"S&P 500 Earnings Dashboard 23Q4 - Thursday, March 28",Looking for stock market analysis and research with proves results? Zacks.com offers in-depth financial research with over 30years of proven results.,2024-03-28
Stocks: Healthy Rotation Or Concerning Distribution?,Looking for stock market analysis and research with proves results? Zacks.com offers in-depth financial research with over 30years of proven results.,2024-03-28
Comparing Gold: Is It Overvalued Against Stocks And Crypto,Looking for stock market analysis and research with proves results? Zacks.com offers in-depth financial research with over 30years of proven results.,2024-03-28
Quick Thoughts: Do Elections Matter For Markets?,The upcoming US elections transcend political rivalry. Franklin Institute's Stephen Dover examines policy differences between the major parties and their potential implications on markets.,2024-03-28
"SPY: Potential, Yes, But Risks Ahead Too","S&P 500 and its replica fund, SPDR S&P 500 ETF Trust, have seen positive performance in Q1 2024. Explore more details here.",2024-03-28
Investor sentiments turn bullish as major market averages rise,Looking for stock market analysis and research with proves results? Zacks.com offers in-depth financial research with over 30years of proven results.,2024-03-28
"If I Could Only Own 4 Dividend Funds, It Would Be These",Dividend investing is a powerful method for compounding wealth over the long term. Click here to see my favorite dividend ETFs for compounding long-term wealth.,2024-03-28
EXCLUSIVE: Pharma's Cloud Revolution — A $60B Market By 2030 With 1 Stock To Watch,Looking for stock market analysis and research with proves results? Zacks.com offers in-depth financial research with over 30years of proven results.,2024-03-28
Small Cap Returns Point To Interest Rate Worries,Looking for stock market analysis and research with proves results? Zacks.com offers in-depth financial research with over 30years of proven results.,2024-03-28
Missed Out on the Bull Market Recovery? 3 ETFs to Help You Build Wealth for Decades.,You can't go back in time and do things over again. But you can certainly avoid making the same mistake twice in a row.,2024-03-28
"US Economic Growth Upwardly Revised To 3.4% In Q4, Jobless Claims Slow: Thursday's Economic Digest (UPDATED)",Looking for stock market analysis and research with proves results? Zacks.com offers in-depth financial research with over 30years of proven results.,2024-03-28
